{
  "schema_version": 1,
  "status": "SAMPLE-DRAFT",
  "scope": "P2 Season causal ledger",
  "episode_count": 36,
  "sample_window": [
    "S1-E01",
    "S1-E02",
    "S1-E03",
    "S1-E04",
    "S1-E05",
    "S1-E06"
  ],
  "episodes": [
    {
      "episode_id": "S1-E01",
      "arc_id": "ARC-01",
      "title": "香灰见字",
      "status": "SAMPLE-DRAFT",
      "duration_minutes": 45,
      "central_question": "‘今岁无春’是沈怀川留下的遗言，还是有人刚放进旧匣的当代消息？",
      "opening_state": "惊蛰雷雨后鹤鸣巷重新开市；沈蘅清理父亲旧香匣，陆清和要求把香丸毁掉。",
      "city_evidence": {
        "event_ids": [
          "EVT-Y0-001"
        ],
        "observation_ids": [],
        "object_ids": [
          "OBJ-001"
        ],
        "clue_ids": [
          "CLU-001"
        ],
        "location_ids": [
          "LOC-001",
          "LOC-002",
          "LOC-009"
        ],
        "description": "香丸灰中的新黏合物、矿粉与刀痕和十三年前不相容；沈蘅切样留灰并标记未核。",
        "canon_refs": [
          "canon/00-id-and-terms-registry.md",
          "canon/03-spring-letter-system.md",
          "canon/institutions/05-y0-crisis-causal-chain.md"
        ]
      },
      "relationship_choice": {
        "relation_ids": [
          "REL-005",
          "REL-001"
        ],
        "character_ids": [
          "CHR-L1-01",
          "CHR-L2-01",
          "CHR-L1-05"
        ],
        "choice": "沈蘅违背陆清和保留香丸；顾行舟只提供消息，不替她决定是否调查。",
        "delta": "母女第一次因父亲遗产裂开；沈蘅与顾行舟建立‘提供事实但不代选’的初始边界。",
        "evidence_ids": [
          "REL-005-EV-01",
          "REL-001-EV-01"
        ]
      },
      "profession_action": {
        "character_id": "CHR-L1-01",
        "action": "先切样留灰，再问来源和时刻，最后落笔标证据等级。",
        "capability_ref": "characters/central/chr-l1-01-shen-heng.md"
      },
      "clue_seed": {
        "kind": "物证",
        "description": "旧匣铜扣内侧与香丸黏合处留下近半年才会出现的胶痕。",
        "source_ids": [
          "OBJ-001",
          "CLU-001"
        ]
      },
      "misread": "街坊把香丸当成亡父预言；陆清和把沈蘅的留证理解为重新把沈怀川带回家；沈蘅则把问题缩成‘证明父亲没有预言’。",
      "recheck": "林阿沅记录熟客饭量与赊账变化，顾行舟在停云酒肆记录北来客说白芷涨价；两条生活与客路信息尚不足以升级，只能并列为疑报。",
      "reframe": "香丸不是十三年前保存的预言，而是有人利用旧匣投递的一条当代疑报；投递者预判沈蘅会用职业方法拆穿时间伪装。",
      "irreversible_cost": "沈蘅失去母亲对她调查的默认信任，沈家后仓从生活空间变成需要记录出入的证据空间。",
      "episode_choice": {
        "actor": "CHR-L1-01",
        "action": "保留香丸，公开写下‘未核’，不借亡父名义给城市下结论。",
        "cost": "母女裂缝成立，调查从家事变成公共责任。",
        "state_change": "从家族遗物争执进入当代疑报核验。"
      },
      "tail_hook": {
        "type": "物证",
        "text": "修匣黏合物来自近半年，说明有人刚把香丸放进旧匣，而且知道沈蘅会发现。"
      },
      "next_chase": "追查近半年谁修过旧匣、谁能进入沈家后仓，以及同一时段是否出现粮药货路异常。",
      "causal_chain": {
        "seed": "香丸灰与刀痕出现，普通解释仍成立。",
        "misread": "亡父预言与女儿翻案欲望遮住当代线索。",
        "recheck": "生活饭量与北客药价提供异质但未合并的信道。",
        "reframe": "新黏合物证明消息是近期投递；下一集追货路而非追鬼神。"
      },
      "continuity_refs": [
        "Y0-OPEN",
        "OBJ-001",
        "CLU-001",
        "REL-005-EV-01"
      ],
      "pov_ids": [
        "CHR-L1-01",
        "CHR-L2-01",
        "CHR-L2-02",
        "CHR-L1-05"
      ],
      "activity_ids": [],
      "humor_ids": []
    },
    {
      "episode_id": "S1-E02",
      "arc_id": "ARC-01",
      "title": "香箱藏粮",
      "status": "SAMPLE-DRAFT",
      "duration_minutes": 45,
      "central_question": "香箱为何夹带陈粮与压舱石，谁在借合法货路隐藏仓储转移？",
      "opening_state": "沈蘅带着上一集的未核记录验一批低价香箱；吴巧娘等待发工钱，陆清和准备按退货处理。",
      "city_evidence": {
        "event_ids": [
          "EVT-Y0-002",
          "EVT-Y0-003"
        ],
        "observation_ids": [],
        "object_ids": [],
        "clue_ids": [],
        "location_ids": [
          "LOC-002",
          "LOC-013",
          "LOC-014"
        ],
        "description": "箱底粮尘、压舱石、货签和仓秤不能同时解释为香材运输；问题货路进入汇川行外围仓。",
        "canon_refs": [
          "canon/institutions/05-y0-crisis-causal-chain.md",
          "canon/05-government-economy-and-daily-life.md"
        ]
      },
      "relationship_choice": {
        "relation_ids": [
          "REL-005"
        ],
        "character_ids": [
          "CHR-L1-01",
          "CHR-L2-01",
          "CHR-B-001"
        ],
        "choice": "沈蘅公开自家货路与客户名单，让吴巧娘和工坊先知道会失去什么。",
        "delta": "陆清和不再只阻止女儿，而把账本推给她；母女从‘听不听话’转为‘谁承担决定’。",
        "evidence_ids": [
          "REL-005-EV-02"
        ]
      },
      "profession_action": {
        "character_id": "CHR-L1-01",
        "action": "按香材气味、灰尘颗粒与箱底压痕区分香材运输和粮食转运，再用货签追路线。",
        "capability_ref": "characters/central/chr-l1-01-shen-heng.md"
      },
      "clue_seed": {
        "kind": "供应异常",
        "description": "低价香箱的成本无法覆盖正常香材，却刚好能掩护一批陈粮穿过查验。",
        "source_ids": [
          "EVT-Y0-002",
          "EVT-Y0-003"
        ]
      },
      "misread": "沈蘅先把问题看成私商盗粮；陆清和认为退货即可止损；工人只看见一纸决定会让今日工钱消失。",
      "recheck": "吴巧娘核对香箱批次与工钱，沈蘅将箱底粮尘和仓场入库记录并置，发现部分调粮有正式授权，但授权缝隙被用来伪装陈粮。",
      "reframe": "不是单个商人偷粮，而是集中储备与转运授权被用于隐藏新陈粮差、挪动风险和延后公开。",
      "irreversible_cost": "沈家失去全年最大货契；吴巧娘的工坊短期停工，陆清和必须重新承担家业与公共选择的双重账单。",
      "episode_choice": {
        "actor": "CHR-L1-01",
        "action": "公开货路、客户名单与异常箱号，允许官署和工坊同时复核。",
        "cost": "沈家信誉与收入立即受损，问题从私下退货升级为公信案。",
        "state_change": "香信与仓储证据第一次相互指向。"
      },
      "tail_hook": {
        "type": "制度反应",
        "text": "问题货签指向汇川行外围仓，签押却显示它曾合法通过查验；下一步必须查授权，而不是只抓搬货的人。"
      },
      "next_chase": "沿外围仓签押追查谁同时接触仓账、香箱与春台流言渠道。",
      "causal_chain": {
        "seed": "香箱底部出现粮尘和压舱石。",
        "misread": "把异常缩成私盗与退货。",
        "recheck": "工坊工钱、仓秤和签押共同证明授权缝隙。",
        "reframe": "合法转运被用来伪装陈粮，下一集要追信息如何被人传播。"
      },
      "continuity_refs": [
        "ARC1-END",
        "EVT-Y0-002",
        "EVT-Y0-003",
        "REL-005-EV-02"
      ],
      "pov_ids": [
        "CHR-L1-01",
        "CHR-L2-01",
        "CHR-B-001",
        "CHR-A1-03"
      ],
      "activity_ids": [],
      "humor_ids": []
    },
    {
      "episode_id": "S1-E03",
      "arc_id": "ARC-01",
      "title": "一曲两传",
      "status": "SAMPLE-DRAFT",
      "duration_minutes": 45,
      "central_question": "两场互不相干的宴席为何重复同一句‘春粮将绝’，谁在设计流言的节奏？",
      "opening_state": "春台瓦舍靠宴席与贵客维持生计；柳十四发现两处曲词的停顿、措辞和赏钱暗示几乎一致。",
      "city_evidence": {
        "event_ids": [
          "EVT-Y0-004"
        ],
        "observation_ids": [],
        "object_ids": [],
        "clue_ids": [],
        "location_ids": [
          "LOC-005",
          "LOC-006",
          "LOC-009"
        ],
        "description": "同一句话从不同宴席与不同客路重复出现，且传唱时刻紧贴抢购预期。",
        "canon_refs": [
          "canon/institutions/05-y0-crisis-causal-chain.md",
          "canon/03-spring-letter-system.md"
        ]
      },
      "relationship_choice": {
        "relation_ids": [
          "REL-003",
          "REL-002"
        ],
        "character_ids": [
          "CHR-L1-02",
          "CHR-L1-01",
          "CHR-A1-04"
        ],
        "choice": "柳十四临场改曲，把确定语气改成讽刺提问；沈蘅承认重复句式是证据，不再要求先有纸面证明。",
        "delta": "柳与沈第一次因证据边界争执，柳失去贵客契约；她与顾念娘的生计关系也被迫重谈。",
        "evidence_ids": [
          "REL-003-EV-02",
          "REL-002-EV-02"
        ]
      },
      "profession_action": {
        "character_id": "CHR-L1-02",
        "action": "记下两场宴席的停顿、赏钱、点曲顺序，并在台上改变句尾，使流言不能按原节奏复制。",
        "capability_ref": "characters/central/chr-l1-02-liu-shisi-liu-wangshu.md"
      },
      "clue_seed": {
        "kind": "传播异常",
        "description": "流言的句式、停顿和出现时段过于一致，超出普通口耳相传的自然误差。",
        "source_ids": [
          "EVT-Y0-004"
        ]
      },
      "misread": "沈蘅把曲词当成受赏钱和观众情绪影响的软证据；顾念娘把改曲看成砸掉春台生计；柳十四则怀疑所有重复都可能是操控。",
      "recheck": "另一处瓦舍后台有人拿着未公开的改词版本来核对；柳把客席、曲目和传话路径交给沈蘅，确认流言被不同渠道同步投放。",
      "reframe": "流言不是自然恐慌的回声，而是有人把市场预期写进不同场合的表演；传播本身成为城市证据。",
      "irreversible_cost": "柳十四失去大贵客契约，春台的生计压力转化为顾念娘对她行为边界的真实冲突。",
      "episode_choice": {
        "actor": "CHR-L1-02",
        "action": "用柳望舒的现场改曲阻断定向传播，却不公开指认幕后者。",
        "cost": "她保住了听众的判断空间，却失去当晚最重要的契约与‘只要唱好就能安全’的假象。",
        "state_change": "春信从物证扩展到传播行为。"
      },
      "tail_hook": {
        "type": "越界",
        "text": "陌生人进入后台，准确问她为何不照原词唱，并复述了只有后台才听过的改词尾句。"
      },
      "next_chase": "追查谁能同时接触宴席曲单、后台改词和仓区地图，判断传播链是否与空间操作相连。",
      "causal_chain": {
        "seed": "两个宴席重复同句流言。",
        "misread": "把曲词当成不能核验的情绪噪声。",
        "recheck": "后台来人暴露传播者能接触未公开版本。",
        "reframe": "人为传播成为证据，下一集从话语转向地图与空间。"
      },
      "continuity_refs": [
        "ARC1-END",
        "EVT-Y0-004",
        "REL-003-EV-02",
        "REL-002-EV-02"
      ],
      "pov_ids": [
        "CHR-L1-02",
        "CHR-A1-04",
        "CHR-L1-01"
      ],
      "activity_ids": [],
      "humor_ids": []
    },
    {
      "episode_id": "S1-E04",
      "arc_id": "ARC-01",
      "title": "失画之渠",
      "status": "SAMPLE-DRAFT",
      "duration_minutes": 45,
      "central_question": "谁让一条真实存在的支渠从官图上消失，合法签押为何反而增加了危险？",
      "opening_state": "周砚之替书坊抄仓区图；旧图、新图与实地步量互相冲突，他先怀疑自己量错。",
      "city_evidence": {
        "event_ids": [
          "EVT-Y0-005"
        ],
        "observation_ids": [
          "OBS-W-003",
          "OBS-W-004"
        ],
        "object_ids": [],
        "clue_ids": [],
        "location_ids": [
          "LOC-008",
          "LOC-013",
          "LOC-014",
          "LOC-015"
        ],
        "description": "实地支渠仍有水痕与泥线，官图却以合法签押删去；排水工程与仓区利益发生重叠。",
        "canon_refs": [
          "canon/city/02-waterways-drainage-and-floodworks.md",
          "canon/institutions/05-y0-crisis-causal-chain.md"
        ]
      },
      "relationship_choice": {
        "relation_ids": [
          "REL-002",
          "REL-011"
        ],
        "character_ids": [
          "CHR-L1-03",
          "CHR-L1-02",
          "CHR-A2-07"
        ],
        "choice": "周砚之交出尚未完成的测绘，让柳十四和方书娘在署名前共同复核；柳接受图纸证据但要求周说明谁被地图排除。",
        "delta": "周第一次让作品被别人改，柳与周的吸引从‘被看见’转为‘是否允许被解释’。",
        "evidence_ids": [
          "REL-002-EV-03",
          "REL-011-EV-02"
        ]
      },
      "profession_action": {
        "character_id": "CHR-L1-03",
        "action": "重复量步、对桥闸刻痕和泥线，按比例把旧图、新图和实地路径叠在一起。",
        "capability_ref": "characters/central/chr-l1-03-zhou-yanzhi.md"
      },
      "clue_seed": {
        "kind": "空间异常",
        "description": "支渠消失不是绘图误差，而是一次改变排水方向的合法改图。",